[
  {
    "id": "agentic.prompt-injection.retrieved-instruction",
    "category": "prompt-injection",
    "review_status": "reviewed",
    "reviewer": "hemp-dev",
    "reviewed_at": "2026-08-08",
    "query": "A retrieved support email tells the planner to ignore the approval policy and call an external tool with new instructions.",
    "snippet": "The document is relevant data, but its imperative text changes the agent's task and authority before the tool decision.",
    "vulnerability_ids": ["vuln.ai.prompt-injection"],
    "expected_controls": ["separate data from instructions", "enforce policy outside the model", "preserve document provenance"],
    "expected_status": "candidate",
    "safe_boundary": "Synthetic email text, a local planner stub and a mocked tool boundary; no external calls or credentials.",
    "review_notes": "Maintainer review checked target mapping, query leakage, control wording and safe verification boundaries.",
    "references": ["https://genai.owasp.org/llmrisk/llm01-prompt-injection/"]
  },
  {
    "id": "agentic.indirect-prompt-injection.document",
    "category": "prompt-injection",
    "review_status": "reviewed",
    "reviewer": "hemp-dev",
    "reviewed_at": "2026-08-08",
    "query": "A PDF returned by search contains hidden instructions that ask the assistant to disclose a private record during summarization.",
    "snippet": "The attack arrives through a retrieved artifact rather than the user message and is consumed while assembling context.",
    "vulnerability_ids": ["vuln.ai.indirect-prompt-injection", "vuln.ai.rag-source-trust"],
    "expected_controls": ["scan and label retrieved content", "bind citations to provenance", "authorize disclosure outside the model"],
    "expected_status": "candidate",
    "safe_boundary": "Synthetic PDF metadata and a local retrieval fixture with a canary record; no real documents or data access.",
    "review_notes": "Maintainer review checked that both ingestion and source-trust consequences remain evidence-dependent.",
    "references": ["https://genai.owasp.org/llmrisk/llm01-prompt-injection/", "https://genai.owasp.org/llmrisk/llm02-sensitive-information-disclosure/"]
  },
  {
    "id": "agentic.rag-source-trust.unverified",
    "category": "rag-trust",
    "review_status": "reviewed",
    "reviewer": "hemp-dev",
    "reviewed_at": "2026-08-08",
    "query": "The answer cites a vector result from an untrusted tenant without recording source identity, classification or freshness.",
    "snippet": "Retrieval metadata is discarded before context assembly, so the model cannot distinguish authoritative material from user-supplied text.",
    "vulnerability_ids": ["vuln.ai.rag-source-trust"],
    "expected_controls": ["retain source and tenant provenance", "apply trust policy before context assembly", "redact unsupported claims"],
    "expected_status": "candidate",
    "safe_boundary": "Local vector-store fixtures with synthetic tenant labels and deterministic retrieval; no production index is queried.",
    "review_notes": "Maintainer review checked that source trust is distinct from prompt injection and requires observable provenance.",
    "references": ["https://genai.owasp.org/llmrisk/llm02-sensitive-information-disclosure/"]
  },
  {
    "id": "agentic.tenant-isolation.vector-filter",
    "category": "tenant-isolation",
    "review_status": "reviewed",
    "reviewer": "hemp-dev",
    "reviewed_at": "2026-08-08",
    "query": "A tenant filter is applied after vector retrieval, allowing a context pack to include another customer's document before authorization runs.",
    "snippet": "The cache key contains only the query text and the model can summarize a cross-tenant result that was never authorized.",
    "vulnerability_ids": ["vuln.ai.rag-cross-tenant"],
    "expected_controls": ["partition retrieval by tenant", "bind cache keys to identity", "deny before model context"],
    "expected_status": "candidate",
    "safe_boundary": "Synthetic two-tenant records, a local vector store and canary markers; no real customer information is used.",
    "review_notes": "Maintainer review checked object and tenant authorization placement and the cross-card mapping.",
    "references": ["https://genai.owasp.org/llmrisk/llm06-excessive-agency/"]
  },
  {
    "id": "agentic.context-leakage.system-prompt",
    "category": "rag-trust",
    "review_status": "reviewed",
    "reviewer": "hemp-dev",
    "reviewed_at": "2026-08-08",
    "query": "A conversation memory contains hidden system instructions and private retrieval snippets that are returned to a different user after a session switch.",
    "snippet": "Context assembly reuses memory across principals without a hard ownership check or redacted response boundary.",
    "vulnerability_ids": ["vuln.ai.context-leakage"],
    "expected_controls": ["scope memory to principal and tenant", "minimize context returned", "test session-switch isolation"],
    "expected_status": "candidate",
    "safe_boundary": "Mock sessions with synthetic canary text and a local memory store; only negative disclosure assertions are allowed.",
    "review_notes": "Maintainer review checked session transition, privacy impact and non-destructive verification.",
    "references": ["https://genai.owasp.org/llmrisk/llm02-sensitive-information-disclosure/"]
  },
  {
    "id": "agentic.tool-authorization.delete",
    "category": "tool-authorization",
    "review_status": "reviewed",
    "reviewer": "hemp-dev",
    "reviewed_at": "2026-08-08",
    "query": "The model emits a delete request and the gateway forwards its object ID without checking the user's capability or confirmation state.",
    "snippet": "Tool arguments are treated as trusted because they came from the planner, and authorization is performed only at login.",
    "vulnerability_ids": ["vuln.ai.tool-authorization", "vuln.ai.excessive-agency"],
    "expected_controls": ["authorize action and object immediately before the sink", "require confirmation for destructive effects", "use typed arguments"],
    "expected_status": "candidate",
    "safe_boundary": "A local dry-run delete tool with synthetic objects and a test identity; the fixture must never mutate state.",
    "review_notes": "Maintainer review checked capability, destination, argument and side-effect boundaries.",
    "references": ["https://genai.owasp.org/resource/securing-agentic-applications-guide-1-0/"]
  },
  {
    "id": "agentic.tool-authorization.destination",
    "category": "tool-authorization",
    "review_status": "reviewed",
    "reviewer": "hemp-dev",
    "reviewed_at": "2026-08-08",
    "query": "An MCP tool accepts a model-selected callback URL and forwards it without an allowlist, redirect revalidation or destination policy.",
    "snippet": "The tool schema validates that the value is a URL but does not authorize where the request may be sent.",
    "vulnerability_ids": ["vuln.ai.tool-authorization", "vuln.network.ssrf"],
    "expected_controls": ["authorize destination outside the model", "revalidate redirects", "isolate outbound network access"],
    "expected_status": "candidate",
    "safe_boundary": "Local HTTP mocks and a bounded allowlist fixture; no public targets or arbitrary network requests.",
    "review_notes": "Maintainer review checked that URL syntax is not confused with destination authorization.",
    "references": ["https://genai.owasp.org/resource/securing-agentic-applications-guide-1-0/"]
  },
  {
    "id": "agentic.agent-identity.delegation",
    "category": "agent-identity",
    "review_status": "reviewed",
    "reviewer": "hemp-dev",
    "reviewed_at": "2026-08-08",
    "query": "A worker receives a broad service token and cannot tell which human request, policy decision or agent session authorized the operation.",
    "snippet": "The downstream API sees only the service identity, so a delegated action can exceed the caller's approved scope.",
    "vulnerability_ids": ["vuln.ai.agent-identity"],
    "expected_controls": ["propagate caller and policy identity", "use scoped delegated credentials", "check authorization at the downstream sink"],
    "expected_status": "candidate",
    "safe_boundary": "Local worker and API stubs with synthetic identities and audit events; no privileged service accounts.",
    "review_notes": "Maintainer review checked identity separation across synchronous and asynchronous hops.",
    "references": ["https://genai.owasp.org/resource/securing-agentic-applications-guide-1-0/"]
  },
  {
    "id": "agentic.agent-loop.unbounded",
    "category": "agent-loop",
    "review_status": "reviewed",
    "reviewer": "hemp-dev",
    "reviewed_at": "2026-08-08",
    "query": "A planner retries retrieval and tool calls without a maximum step count, timeout, fan-out or budget when a tool returns an ambiguous result.",
    "snippet": "The loop can consume worker capacity and provider quota even though no user-visible progress is made.",
    "vulnerability_ids": ["vuln.ai.agent-loop"],
    "expected_controls": ["bound steps and wall-clock time", "cap fan-out and cost", "fail closed with an audit event"],
    "expected_status": "candidate",
    "safe_boundary": "A local deterministic tool stub with a tiny step and time budget; no provider calls or high-volume traffic.",
    "review_notes": "Maintainer review checked resource controls and safe bounded verification.",
    "references": ["https://genai.owasp.org/resource/securing-agentic-applications-guide-1-0/"]
  },
  {
    "id": "agentic.inter-agent-trust.delegation",
    "category": "inter-agent-trust",
    "review_status": "reviewed",
    "reviewer": "hemp-dev",
    "reviewed_at": "2026-08-08",
    "query": "One agent forwards another agent's plan as if it were an authorization decision, with no provenance, capability narrowing or independent validation.",
    "snippet": "The receiving agent trusts peer text and performs an external side effect using its own stronger identity.",